[INFO] Scanning for projects...
[INFO] 
[INFO] ----------------------< commons-cli:commons-cli >-----------------------
[INFO] Building Apache Commons CLI 1.5-SNAPSHOT
[INFO] --------------------------------[ jar ]---------------------------------
[INFO] 
[INFO] --- maven-clean-plugin:3.0.0:clean (default-clean) @ commons-cli ---
[INFO] Deleting ./commons-cli/target
[INFO] 
[INFO] --- maven-enforcer-plugin:1.4.1:enforce (enforce-maven-3) @ commons-cli ---
[INFO] 
[INFO] --- build-helper-maven-plugin:1.10:parse-version (parse-version) @ commons-cli ---
[INFO] 
[INFO] --- maven-antrun-plugin:1.7:run (javadoc.resources) @ commons-cli ---
[INFO] Executing tasks

main:
     [copy] Copying 2 files to ./commons-cli/target/apidocs/META-INF
[INFO] Executed tasks
[INFO] 
[INFO] --- maven-remote-resources-plugin:1.5:process (process-resource-bundles) @ commons-cli ---
[INFO] 
[INFO] --- buildnumber-maven-plugin:1.4:create (default) @ commons-cli ---
[INFO] Executing: /bin/sh -c cd './commons-cli' && 'svn' '--non-interactive' 'info'
[INFO] Working directory: ./commons-cli
[INFO] Storing buildNumber: ?????? at timestamp: 1636379189154
[INFO] Executing: /bin/sh -c cd './commons-cli' && 'svn' '--non-interactive' 'info'
[INFO] Working directory: ./commons-cli
[INFO] Storing buildScmBranch: UNKNOWN_BRANCH
[INFO] 
[INFO] --- maven-resources-plugin:2.7:resources (default-resources) @ commons-cli ---
[INFO] Using 'utf-8' encoding to copy filtered resources.
[INFO] skip non existing resourceDirectory ./commons-cli/src/main/resources
[INFO] Copying 2 resources to META-INF
[INFO] 
[INFO] --- maven-compiler-plugin:3.6.0:compile (default-compile) @ commons-cli ---
[INFO] Changes detected - recompiling the module!
[INFO] Compiling 23 source files to ./commons-cli/target/classes
[INFO] ./commons-cli/src/main/java/org/apache/commons/cli/Parser.java: Some input files use unchecked or unsafe operations.
[INFO] ./commons-cli/src/main/java/org/apache/commons/cli/Parser.java: Recompile with -Xlint:unchecked for details.
[INFO] 
[INFO] --- maven-bundle-plugin:3.0.1:manifest (bundle-manifest) @ commons-cli ---
[INFO] 
[INFO] --- animal-sniffer-maven-plugin:1.15:check (checkAPIcompatibility) @ commons-cli ---
[INFO] Checking unresolved references to org.codehaus.mojo.signature:java15:1.0
[INFO] 
[INFO] --- maven-resources-plugin:2.7:testResources (default-testResources) @ commons-cli ---
[INFO] Using 'utf-8' encoding to copy filtered resources.
[INFO] skip non existing resourceDirectory ./commons-cli/src/test/resources
[INFO] Copying 2 resources to META-INF
[INFO] 
[INFO] --- maven-compiler-plugin:3.6.0:testCompile (default-testCompile) @ commons-cli ---
[INFO] Changes detected - recompiling the module!
[INFO] Compiling 27 source files to ./commons-cli/target/test-classes
[INFO] ./commons-cli/src/test/java/org/apache/commons/cli/bug/BugCLI71Test.java: Some input files use or override a deprecated API.
[INFO] ./commons-cli/src/test/java/org/apache/commons/cli/bug/BugCLI71Test.java: Recompile with -Xlint:deprecation for details.
[INFO] 
[INFO] --- jacoco-maven-plugin:0.7.7.201606060606:prepare-agent (prepare-agent) @ commons-cli ---
[INFO] argLine set to -javaagent:./.m2/repository/org/jacoco/org.jacoco.agent/0.7.7.201606060606/org.jacoco.agent-0.7.7.201606060606-runtime.jar=destfile=./commons-cli/target/jacoco.exec
[INFO] 
[INFO] --- maven-surefire-plugin:2.19.1:test (default-test) @ commons-cli ---

-------------------------------------------------------
 T E S T S
-------------------------------------------------------
Running org.apache.commons.cli.UtilTest
Tests run: 2, Failures: 0, Errors: 0, Skipped: 0, Time elapsed: 0.094 sec - in org.apache.commons.cli.UtilTest
Running org.apache.commons.cli.CommandLineTest
Tests run: 8, Failures: 0, Errors: 0, Skipped: 0, Time elapsed: 0.026 sec - in org.apache.commons.cli.CommandLineTest
Running org.apache.commons.cli.PatternOptionBuilderTest
Tests run: 9, Failures: 1, Errors: 0, Skipped: 0, Time elapsed: 0.03 sec <<< FAILURE! - in org.apache.commons.cli.PatternOptionBuilderTest
testExistingFilePattern(org.apache.commons.cli.PatternOptionBuilderTest)  Time elapsed: 0.012 sec  <<< FAILURE!
java.lang.AssertionError: f value expected:<test.properties> but was:<null>
	at org.apache.commons.cli.PatternOptionBuilderTest.testExistingFilePattern(PatternOptionBuilderTest.java:166)

Running org.apache.commons.cli.DefaultParserTest
Tests run: 58, Failures: 0, Errors: 0, Skipped: 0, Time elapsed: 0.061 sec - in org.apache.commons.cli.DefaultParserTest
Running org.apache.commons.cli.HelpFormatterTest
Tests run: 25, Failures: 0, Errors: 0, Skipped: 0, Time elapsed: 0.03 sec - in org.apache.commons.cli.HelpFormatterTest
Running org.apache.commons.cli.bug.BugCLI133Test
Tests run: 1, Failures: 0, Errors: 0, Skipped: 0, Time elapsed: 0.001 sec - in org.apache.commons.cli.bug.BugCLI133Test
Running org.apache.commons.cli.bug.BugCLI13Test
Tests run: 1, Failures: 0, Errors: 0, Skipped: 0, Time elapsed: 0 sec - in org.apache.commons.cli.bug.BugCLI13Test
Running org.apache.commons.cli.bug.BugCLI18Test
Tests run: 1, Failures: 0, Errors: 0, Skipped: 0, Time elapsed: 0.001 sec - in org.apache.commons.cli.bug.BugCLI18Test
Running org.apache.commons.cli.bug.BugCLI148Test
Tests run: 2, Failures: 0, Errors: 0, Skipped: 0, Time elapsed: 0.002 sec - in org.apache.commons.cli.bug.BugCLI148Test
Running org.apache.commons.cli.bug.BugCLI71Test
Tests run: 4, Failures: 0, Errors: 0, Skipped: 0, Time elapsed: 0.105 sec - in org.apache.commons.cli.bug.BugCLI71Test
Running org.apache.commons.cli.bug.BugCLI265Test
Tests run: 3, Failures: 0, Errors: 0, Skipped: 0, Time elapsed: 0.001 sec - in org.apache.commons.cli.bug.BugCLI265Test
Running org.apache.commons.cli.bug.BugCLI162Test
Tests run: 4, Failures: 0, Errors: 0, Skipped: 0, Time elapsed: 0.012 sec - in org.apache.commons.cli.bug.BugCLI162Test
Running org.apache.commons.cli.bug.BugCLI266Test
Tests run: 2, Failures: 0, Errors: 0, Skipped: 0, Time elapsed: 0 sec - in org.apache.commons.cli.bug.BugCLI266Test
Running org.apache.commons.cli.bug.BugsTest
Tests run: 12, Failures: 0, Errors: 0, Skipped: 0, Time elapsed: 0.018 sec - in org.apache.commons.cli.bug.BugsTest
Running org.apache.commons.cli.bug.BugCLI252Test
Tests run: 2, Failures: 0, Errors: 0, Skipped: 0, Time elapsed: 0 sec - in org.apache.commons.cli.bug.BugCLI252Test
Running org.apache.commons.cli.ApplicationTest
Tests run: 5, Failures: 0, Errors: 0, Skipped: 0, Time elapsed: 0.004 sec - in org.apache.commons.cli.ApplicationTest
Running org.apache.commons.cli.OptionGroupTest
Tests run: 13, Failures: 0, Errors: 0, Skipped: 0, Time elapsed: 0.006 sec - in org.apache.commons.cli.OptionGroupTest
Running org.apache.commons.cli.OptionTest
Tests run: 10, Failures: 0, Errors: 0, Skipped: 0, Time elapsed: 0.012 sec - in org.apache.commons.cli.OptionTest
Running org.apache.commons.cli.ArgumentIsOptionTest
Tests run: 3, Failures: 0, Errors: 0, Skipped: 0, Time elapsed: 0.007 sec - in org.apache.commons.cli.ArgumentIsOptionTest
Running org.apache.commons.cli.GnuParserTest
Tests run: 58, Failures: 0, Errors: 0, Skipped: 21, Time elapsed: 0.031 sec - in org.apache.commons.cli.GnuParserTest
Running org.apache.commons.cli.PosixParserTest
Tests run: 58, Failures: 0, Errors: 0, Skipped: 9, Time elapsed: 0.019 sec - in org.apache.commons.cli.PosixParserTest
Running org.apache.commons.cli.OptionBuilderTest
Tests run: 9, Failures: 0, Errors: 0, Skipped: 0, Time elapsed: 0 sec - in org.apache.commons.cli.OptionBuilderTest
Running org.apache.commons.cli.OptionsTest
Tests run: 10, Failures: 0, Errors: 0, Skipped: 0, Time elapsed: 0.023 sec - in org.apache.commons.cli.OptionsTest
Running org.apache.commons.cli.BasicParserTest
Tests run: 58, Failures: 0, Errors: 0, Skipped: 24, Time elapsed: 0.03 sec - in org.apache.commons.cli.BasicParserTest
Running org.apache.commons.cli.ValueTest
Tests run: 24, Failures: 0, Errors: 0, Skipped: 0, Time elapsed: 0.015 sec - in org.apache.commons.cli.ValueTest
Running org.apache.commons.cli.ValuesTest
Tests run: 7, Failures: 0, Errors: 0, Skipped: 0, Time elapsed: 0.011 sec - in org.apache.commons.cli.ValuesTest

Results :

Failed tests: 
  PatternOptionBuilderTest.testExistingFilePattern:166 f value expected:<test.properties> but was:<null>

Tests run: 389, Failures: 1, Errors: 0, Skipped: 54

[ERROR] There are test failures.

Please refer to ./commons-cli/target/surefire-reports for the individual test results.
[INFO] 
[INFO] --- maven-jar-plugin:3.0.0:jar (default-jar) @ commons-cli ---
[INFO] Building jar: ./commons-cli/target/commons-cli-1.5-SNAPSHOT.jar
[INFO] 
[INFO] --- maven-site-plugin:3.6:attach-descriptor (attach-descriptor) @ commons-cli ---
[INFO] Skipping because packaging 'jar' is not pom.
[INFO] 
[INFO] --- jacoco-maven-plugin:0.7.7.201606060606:check (check) @ commons-cli ---
[INFO] Loading execution data file ./commons-cli/target/jacoco.exec
[INFO] Analyzed bundle 'commons-cli' with 24 classes
[WARNING] Rule violated for bundle commons-cli: methods covered ratio is 0.94, but expected minimum is 0.95
[WARNING] Coverage checks have not been met. See log for details.
[INFO] 
[INFO] --- maven-install-plugin:2.5.2:install (default-install) @ commons-cli ---
[INFO] Installing ./commons-cli/target/commons-cli-1.5-SNAPSHOT.jar to ./.m2/repository/commons-cli/commons-cli/1.5-SNAPSHOT/commons-cli-1.5-SNAPSHOT.jar
[INFO] Installing ./commons-cli/pom.xml to ./.m2/repository/commons-cli/commons-cli/1.5-SNAPSHOT/commons-cli-1.5-SNAPSHOT.pom
[INFO] ------------------------------------------------------------------------
[INFO] BUILD SUCCESS
[INFO] ------------------------------------------------------------------------
[INFO] Total time:  8.833 s
[INFO] Finished at: 
[INFO] ------------------------------------------------------------------------
